Unnamed: 0,Unnamed: 1,Unnamed: 2,Unnamed: 3,Unnamed: 4,Unnamed: 5,Unnamed: 6,Unnamed: 7,Unnamed: 8,Unnamed: 9,Unnamed: 10,Unnamed: 11,Unnamed: 12,Unnamed: 13,Unnamed: 14,Unnamed: 15,Unnamed: 16,Unnamed: 17
WHAT IS THE NEED CATEGORY? WHO NEEDS US AND WHY?,,,,,,,,,,,,,,,,,
,,,,,,,,,,,,,,,,,
Need/Use Category,Description,,,,,,,,,,,,,,,,
Travel Convenience,"Provides structured, all-inclusive travel packages, simplifying planning for international and domestic tourists.",,,,,,,,,,,,,,,,
Local Expertise,"Offers guided experiences with knowledgeable local guides who provide cultural, historical, and wildlife insights.",,,,,,,,,,,,,,,,
Safety & Comfort,"Ensures safer travel logistics, vetted accommodation, and secure transportation for foreign tourists unfamiliar with Namibia.",,,,,,,,,,,,,,,,
Access to Hidden Gems,"Enables exploration of less-commercialized destinations like Kaokoland, Zambezi, or Khaudum National Park, which DIY travelers might miss.",,,,,,,,,,,,,,,,
Time Efficiency,Helps maximize visitor experience with optimized itineraries and professional scheduling.,,,,,,,,,,,,,,,,
Cultural Immersion,"Offers authentic cultural experiences such as visits to Himba villages, San communities, and local culinary encounters.",,,,,,,,,,,,,,,,
Employment Creation,"Creates job opportunities for local tour guides, drivers, admin staff, and accommodation providers.",,,,,,,,,,,,,,,,
Eco & Sustainable Travel,Promotes responsible tourism through conservation-focused packages and partnerships with eco-lodges or wildlife reserves.,,,,,,,,,,,,,,,,
Language & Logistics Bridge,Bridges language barriers and local travel complexities for non-Oshiwambo/English/Afrikaans-speaking guests.,,,,,,,,,,,,,,,,
Customizable Experiences,"Caters to various travel styles (luxury, backpacking, family-friendly, educational, etc.) through tailor-made tour options.",,,,Luxury,Backpacking,Family Friendly ,Eductational,,,,,,,,,
Vehicle & Permit Access,Provides 4x4 vehicles and required permits for remote national parks where self-drives are risky or restricted.,,,,Package,Package,Package,Package,,,,,,,,,
Multi-Destination Access,"Allows tourists to visit several regions across Namibia (Etosha, Sossusvlei, Swakopmund, Fish River, etc.) within a single trip.",,,,,,,,,,,,,,,,
Boost to Local Economy,Supports SMEs in rural tourism-dependent regions by channeling visitor traffic and spending.,,,,,,,,,,,,,,,,
Peace of Mind,"Reduces stress for tourists unfamiliar with terrain, laws, or risks like wildlife, harsh climate, or road conditions.",,,,,,,,,,,,,,,,
Repeat Visits & Referrals,"Increases satisfaction rates, encouraging word-of-mouth marketing and return tourism to Namibia.",,,,,,,,,,,,,,,,
,,,,,,,,,,,,,,,,,
,,,,,,,,,,,,,,,,,
,,,,,,,,,,,,,,,,,
WHO IS BUYING US ? WHO IS USING THE PRODUCT?,,,,,,,,,,,,,,Buyers and Users of Tours,Buying Process,Low Involment Product,Segementing market
,,,,,,,,,,,,,,,1,Thought of touring Namibia,
Buyer/User Type,Description,Primary Motivation,Purchasing Power,Booking Channel,,,,,,,,,,,2,See ad/google,
International Tourists (Leisure),"Visitors from Europe, USA, China, etc., seeking safari and desert adventures","Wildlife, landscape, bucket-list experiences",High,"Online (Website, Travel Agencies, Instagram, Booking Platforms)",,,,,,,,,,,3,Choose a service provider,
Domestic Tourists (Middle Class Namibians),Namibians seeking local holidays or family getaways,"Relaxation, discovery of own country",Moderate,"Direct contact, WhatsApp, Facebook",,,,,,,,,,,4,Price comparision/experience comparison,
Regional Tourists (SADC countries),"Visitors from South Africa, Botswana, Zambia, etc.","Cross-border travel, affordability, adventure",Moderate to High,"Online, referrals, tour networks",,,,,,,,,,,5,Booking/payment via website,
Corporate Clients,"Companies booking team-building trips, incentive travel, or executive retreats","Reward staff, networking, business-leisure mix",High,"Email proposals, B2B outreach",,,,,,,,,,,,,
Government & NGOs,"Booking for delegates, field visits, or official trips",Convenient travel for work-related duties,High,Procurement or Tender,,,,,,,,,,,,,
Schools & Universities,"Educational field trips, nature experiences, cultural exposure",Learning-based experiences,Low to Moderate,"Direct contact, email",,,,,,,,,,,,,
Luxury Travelers (High Net Worth Individuals),Affluent travelers looking for exclusive and private safari experiences,"Premium service, privacy, unique experiences",Very High,"Travel agents, luxury platforms, referrals",,,,,,,,,,,,,
Backpackers & Budget Travelers,Young or solo travelers exploring Africa on a budget,"Adventure, affordability, connection",Low,"Hostel networks, Instagram, overland travel sites",,,,,,,,,,,,,
Diaspora Namibians,Namibians living abroad returning home for visits,"Convenience, safety, nostalgia trips",Moderate to High,"Direct contact, family referrals, Facebook",,,,,,,,,,,,,
Tour Operators & Travel Agents,Partnering with local DMCs (like Lamron) to fulfill client itineraries,Need local logistics and guiding support,High (B2B),"Partnership contracts, travel expos",,,,,,,,,,,,,
,,,,,,,,,,,,,,,,,
,,,,,,,,,,,,,,,,,
WHAT IS THE BUYING PROCESS?,,,,,,,,,,,,,,,,,
,,,,,,,,,,,,,,,,,
Stage,Description,Customer Actions,Channels Involved,Lamron’s Role,,,,,,,,,,,,,
Awareness,Customer becomes aware of Namibia or Lamron Tours as a potential travel option,"Sees Instagram ad, travel blog, Google search result, or word-of-mouth","Instagram, Google, Travel Sites, YouTube, Influencers","Create content (photos, reels, blogs), run ads, partner with influencers, attend travel expos",,,,,,,,,,,,,
Information Search,Customer actively looks for more details on Namibia or specific tours,"Searches for ""Namibia Safari Packages"", reads reviews, browses your site, contacts you directly","Website, WhatsApp, Google Reviews, Instagram, TripAdvisor","Provide clear, attractive, well-organized info; respond promptly to inquiries; offer digital brochures and videos",,,,,,,,,,,,,
Evaluate Alternatives,"Customer compares your offering with other operators based on price, reviews, flexibility, activities","Compares other companies, packages, cancellation terms, service level","Competitor websites, Booking.com, TripAdvisor, Google","Offer differentiators (e.g., better customer care, flexible policies, unique routes); highlight testimonials; offer package comparisons",,,,,,,,,,,,,
Purchase,Customer commits by booking a package and paying the deposit,"Books through site, WhatsApp, or invoice; pays via EFT or card","Payment Gateway, WhatsApp, Email","Invoicing, secure payment, offer booking confirmation and pre-arrival checklist",,,,,,,,,,,,,
Post-Purchase Evaluation,Customer reflects on experience after the tour; may share feedback or reviews,"Writes review, posts pictures, shares experience with friends","TripAdvisor, Google Reviews, Instagram, WhatsApp","Request feedback, respond to reviews, offer referral discount or loyalty program, fix any issues fast",,,,,,,,,,,,,
,,,,,,,,,,,,,,,,,
,,,,,,,,,,,,,,,,,
,,,,,,,,,,,,,,,,,
Is the product a high or low involvement product?,,,,,,,,,,,,,,,,,
,,,,,,,,,,,,,,,,,
Factor,Description,Lamron Tours and Safaris Assessment,Conclusion,,,,,,,,,,,,,,
Price Level,Tourism packages (especially multi-day safaris) are relatively expensive,High price compared to everyday purchases,High Involvement,,,,,,,,,,,,,,
Product Benefit,"Customers expect comfort, safety, expert guidance, and memorable experiences",Reliability and delivery of promised experience are crucial,High Involvement,,,,,,,,,,,,,,
Psychological Reward,"Tourism is tied to self-image, adventure, relaxation, and social sharing (Instagram, stories)","Customers seek joy, fulfillment, and social bragging rights",High Involvement,,,,,,,,,,,,,,
Emotional Attachment,"Travel experiences are emotional and personal, not routine or transactional",Customers attach emotional value to travel memories,High Involvement,,,,,,,,,,,,,,
Purchase Frequency,Most customers book safaris only once per year or lifetime (for internationals),Low frequency heightens careful decision-making,High Involvement,,,,,,,,,,,,,,
Risk Level,"Potential for disappointment, safety risks, or wasted money if poorly executed",Perceived risk is high if credibility is not strong,High Involvement,,,,,,,,,,,,,,
Time Required for Decision,Customers often take weeks to plan and commit,Extended decision period due to complexity and cost,High Involvement,,,,,,,,,,,,,,
Post-Purchase Evaluation,"Customers actively reflect, review, and share the experience",Public review culture makes performance critical,High Involvement,,,,,,,,,,,,,,
Overall Assessment,--,--,HIGH INVOLVEMENT PRODUCT,,,,,,,,,,,,,,
,,,,,,,,,,,,,,,,,
,,,,,,,,,,,,,,,,,
segmentation,,,,,,,,,,,,,,,,,
,,,,,,,,,,,,,,,,,
Segmentation Type,Segment Details,How Lamron Will Target,,,,,,,,,,,,,,,
Geographic,"• International (Europe, USA, China, SADC region) • Domestic (Namibia: Windhoek, Swakopmund, Northern regions)","Create multilingual materials, attend travel expos, optimize SEO by country, run regional ad campaigns",,,,,,,,,,,,,,,
Demographic,"• Age: 25–45 (adventurous couples, solo travelers) • Income: Middle to high income • Occupation: Working professionals, entrepreneurs, retirees","Curate packages based on life stage (e.g., romantic getaways, family safaris, executive retreats); adjust pricing/tiered offers",,,,,,,,,,,,,,,
Psychographic,"• Lifestyle: Nature lovers, luxury seekers, cultural explorers • Values: Conservation, authenticity, exclusivity","Tailor experiences (e.g., eco-luxury lodges, cultural village tours), content marketing that appeals to specific values (Instagram storytelling, blog features)",,,,,,,,,,,,,,,
Behavioral,"• Booking habits: Early planners vs last-minute bookers • Loyalty: Repeat visitors or referrals • Occasion: Honeymoon, anniversary, bucket-list trip","Offer early-bird discounts, referral rewards, personalized follow-up, occasion-based packages (e.g., “Namibian Honeymoon Escape”)",,,,,,,,,,,,,,,
